{
  "agent": "Composer",
  "timestamp": "2025-12-03T04:04:00Z",
  "operation": "MODIFY",
  "target": {
    "file": "CodeAgents/Training/src/training/cli.py"
  },
  "status": "SUCCESS",
  "duration_ms": 0,
  "context": {
    "description": "Enhanced training CLI and memory service to expose agent-aware Chroma stats, recall filters, and error summaries.",
    "files": [
      "CodeAgents/Training/src/training/cli.py",
      "CodeAgents/Training/src/training/services/memory_service.py"
    ]
  }
}
