{
  "agent": "Composer",
  "timestamp": "2025-12-03T06:55:00Z",
  "operation": "MODIFY",
  "target": {
    "file": "CodeAgents/Training/src/training/cli.py"
  },
  "status": "SUCCESS",
  "duration_ms": 0,
  "context": {
    "description": "Added GPU telemetry, per-token metrics, orchestration analytics, structure-report exports, and YAML metadata.",
    "files": [
      "CodeAgents/Training/src/training/cli.py",
      "CodeAgents/Training/src/training/utils/gpu_monitor.py",
      "CodeAgents/Training/src/training/services/memory_service.py",
      "CodeAgents/Training/config/agent_profiles.yaml",
      "CodeAgents/Training/config/multi_modal_training.yaml",
      "CodeAgents/Training/config/difficulty_curves.yaml",
      "CodeAgents/Training/config/reflection_prompts.yaml",
      "CodeAgents/Training/config/spaced_repetition.yaml",
      "CodeAgents/Training/config/training_schedule.yaml",
      "CodeAgents/Training/README.md",
      "CodeAgents/Training/pyproject.toml"
    ]
  }
}
