{
  "agent": "Composer",
  "timestamp": "2025-12-03T06:20:00Z",
  "operation": "MODIFY",
  "target": {
    "file": "CodeAgents/Training/src/training/cli.py"
  },
  "status": "SUCCESS",
  "duration_ms": 0,
  "context": {
    "description": "Add multi-agent orchestration command plus ConfigService helpers and memory filters to coordinate four agents with Chroma-backed analytics.",
    "files": [
      "CodeAgents/Training/src/training/cli.py",
      "CodeAgents/Training/src/training/services/config_service.py",
      "CodeAgents/Training/src/training/services/memory_service.py"
    ]
  }
}
